{
  "schema_version": "1.0.0",
  "date": "2026-09-06",
  "timezone": "America/Chicago",
  "aggregation_window": {
    "start": "2026-09-06T05:00:00Z",
    "end": "2026-09-07T05:00:00Z"
  },
  "privacy": {
    "contains_personal_identifiers": false,
    "small_count_suppression": true,
    "suppression_threshold": 5,
    "retention_days": 400
  },
  "site_totals": {
    "views": null,
    "source_clicks": null,
    "share_initiations": null,
    "worth_watching_clicks": null,
    "retention_30s": null,
    "feedback_most_useful": 0,
    "feedback_useful": 0,
    "feedback_neutral": 0,
    "feedback_not_useful": 0
  },
  "stories": [
    {
      "story_id": "dab-story-2026-09-06-0b55fd52",
      "metrics": {
        "views": null,
        "source_clicks": null,
        "share_initiations": null,
        "worth_watching_clicks": null,
        "retention_30s": null,
        "feedback_most_useful": 0,
        "feedback_useful": 0,
        "feedback_neutral": 0,
        "feedback_not_useful": 0
      }
    },
    {
      "story_id": "dab-story-2026-09-06-4426ca30",
      "metrics": {
        "views": null,
        "source_clicks": null,
        "share_initiations": null,
        "worth_watching_clicks": null,
        "retention_30s": null,
        "feedback_most_useful": 0,
        "feedback_useful": 0,
        "feedback_neutral": 0,
        "feedback_not_useful": 0
      }
    },
    {
      "story_id": "dab-story-2026-09-06-9839a69b",
      "metrics": {
        "views": null,
        "source_clicks": null,
        "share_initiations": null,
        "worth_watching_clicks": null,
        "retention_30s": null,
        "feedback_most_useful": 0,
        "feedback_useful": 0,
        "feedback_neutral": 0,
        "feedback_not_useful": 0
      }
    },
    {
      "story_id": "dab-story-2026-09-06-3f824b7a",
      "metrics": {
        "views": null,
        "source_clicks": null,
        "share_initiations": null,
        "worth_watching_clicks": null,
        "retention_30s": null,
        "feedback_most_useful": 0,
        "feedback_useful": 0,
        "feedback_neutral": 0,
        "feedback_not_useful": 0
      }
    },
    {
      "story_id": "dab-story-2026-09-06-30dde95b",
      "metrics": {
        "views": null,
        "source_clicks": null,
        "share_initiations": null,
        "worth_watching_clicks": null,
        "retention_30s": null,
        "feedback_most_useful": 0,
        "feedback_useful": 0,
        "feedback_neutral": 0,
        "feedback_not_useful": 0
      }
    },
    {
      "story_id": "dab-story-2026-09-06-fcc3f409",
      "metrics": {
        "views": null,
        "source_clicks": null,
        "share_initiations": null,
        "worth_watching_clicks": null,
        "retention_30s": null,
        "feedback_most_useful": 0,
        "feedback_useful": 0,
        "feedback_neutral": 0,
        "feedback_not_useful": 0
      }
    }
  ],
  "collection_status": "partial",
  "limitations": [
    "Explicit rating-button totals are refreshed for seven days and remain exact because they contain no identifiers."
  ]
}
